"id","author","created","text","parent"
"48378808","bsder","2026-06-03T01:47:03Z","That hyperbolic tree looks very close to what my faulty memory recalls.<p>I suspect it was a later incarnation that I used.","48369370"
"48378796","bsder","2026-06-03T01:45:48Z","No offense was taken.  It&#x27;s always good to hear from the people who actually did stuff to set the record straight.<p>&gt; It was a fun place to be.<p>It was.  I was in the hardware side during the Hostile Giveaway(tm) to Intel and Compaq.<p>Good luck with your cat.","48369496"
"48376936","randbyte","2026-06-02T22:01:39Z","You examples are great… at supporting my points. CRWD ipo’ed at 7bn and NET at 5bn. Unlike the mega IPOs like abnb and uber and now 10x worse spacex. There is very limited upside left after high valuation milking.","48371610"
"48375612","jms703","2026-06-02T20:14:36Z","How do I keep my 401k from investing in AI stocks...","48358646"
"48374615","mrguyorama","2026-06-02T18:57:18Z","How does Stripe need funding anyway, aren&#x27;t they just a payment network with a low effort risk platform? It really shouldn&#x27;t be hard for them to have reliable, sustainable, predictable finances.<p>Jeeze 8500 employees. Even then though.","48362259"
"48374205","throw0101c","2026-06-02T18:28:05Z","&gt; <i>Yes, it might be true that many 80% of people think they&#x27;re above the median skill, but that doesn&#x27;t mean there aren&#x27;t actual above average drivers out there.</i><p>An observation form Nick Maggiulli:<p>&gt; <i>Instead, I am going to argue that you shouldn’t pick stocks because of the</i> existential dilemma <i>of doing so. The existential dilemma is</i> simple—how do you know if you are good at picking individual stocks? <i>In most domains, the amount of time it takes to judge whether someone has skill in that domain is relatively short.<p>&gt; </i>For example, any competent basketball coach could tell you whether someone was skilled at shooting within the course of 10 minutes. Yes, it’s possible to get lucky and make a bunch of shots early on, but eventually they will trend toward their actual shooting percentage. The same is true in a technical field like computer programming. Within a short period of time, a good programmer would be able to tell if someone doesn’t know what they are talking about.*<p>[…]<p>&gt; <i>But, what about stock picking? How long would it take to determine if someone is a good stock picker?</i><p>&gt; <i>An hour? A week? A year?</i><p>&gt; <i>Try multiple years, and</i> even then <i>you still may not know for sure. The issue is that causality is harder to determine with stock picking than with other domains. When you shoot a basketball or write a computer program, the result comes </i>immediately* after the action. The ball goes in the hoop or it doesn’t. The program runs correctly or it doesn’t.* But, with stock picking, you make a decision now and have to wait for it to pay off. The feedback loop can take years.<p>&gt; <i>And the payoff you do eventually get has to be compared to the payoff of buying an index fund like the S&amp;P 500. So, even if you make money on absolute terms, you can still lose money on relative terms.</i><p>&gt; <i>More importantly though, the result that you get from that decision may have nothing to do with why you made it in the first place. For example, imagine you bought GameStop in late 2020 because you believed that the price would increase as a result of the company improving its operations. Well, 2021 comes along and the price of GameStop surges due to the wallstreetbets inspired short squeeze. You received a positive result that had</i> nothing <i>to do with your original thesis.</i><p>[…]<p>&gt; <i>This is the existential crisis that I am talking about.</i> Why would you want to play a game (or make a career) out of something that you can’t prove that you are good at? <i>If you are doing it for fun, that’s fine.  Take a small portion of your money and have at it. But, for those that aren’t doing it for fun, why spend so much time on something where your skill is so hard to measure?</i><p>[…]<p>&gt; <i>I know I won’t convince every stock picker to change their ways, and that’s a good thing. We need people to keep analyzing companies and deploying their capital accordingly. However, if you are on the fence about it, this is your wake up call. Don’t keep playing a game with so much luck involved. Life already has enough luck as it is.</i><p>* <a href=""https:&#x2F;&#x2F;ofdollarsanddata.com&#x2F;why-you-shouldnt-pick-individual-stocks&#x2F;"" rel=""nofollow"">https:&#x2F;&#x2F;ofdollarsanddata.com&#x2F;why-you-shouldnt-pick-individua...</a>","48371873"
"48373462","icedchai","2026-06-02T17:38:29Z","There were many search engines around during that time. Yahoo, Excite, Microsoft Live Search, Lycos... I don&#x27;t recall any of them improving enough to rival early 2000&#x27;s Google.","48373303"
"48373337","jhy17632","2026-06-02T17:30:29Z","anthropic are so hot right now","48358646"
"48373303","ethbr1","2026-06-02T17:28:18Z","But that only would have lasted until the next search innovation and&#x2F;or competitors copied Google&#x27;s indexing.","48372145"
"48372942","dmoy","2026-06-02T17:01:20Z","I mean, idk what&#x27;s in your 401k fund choices, but in all mine I&#x27;d have to take serious manual effort to get <i>in</i> to QQQ or equivalent","48363061"
"48372515","troyvit","2026-06-02T16:32:59Z","&gt; &#x27;retail&#x27; investors are going to have perhaps 5% of their portfolio in it.<p>If they are the only moonshot style companies in their portfolio, and if they crater that&#x27;s the physical equivalent of a 160lb person carrying a gallon of milk around with them wherever they go. At least until they&#x27;ve drunk it I guess.<p>Lots of &quot;ifs&quot; in that sentence now I read it back though.","48363873"
"48372313","chilipepperhott","2026-06-02T16:19:01Z","Sure, but how often do they rebalance the fund?","48360118"
"48372145","icedchai","2026-06-02T16:08:45Z","I remember late 90&#x27;s, early 2000&#x27;s Google. Search result quality was still better than the competition (mainly Altavista...)","48369477"
"48372095","gizajob","2026-06-02T16:06:25Z","Right, got it. Thanks for the info.","48365616"
"48371873","IncreasePosts","2026-06-02T15:52:39Z","So what? One person isn&#x27;t &quot;most people&quot;. It&#x27;s quite possible that one person has certain insights that the market generally doesn&#x27;t have or isn&#x27;t accounting for. I&#x27;ve made 20x what an index fund would have returned since 2002 because I&#x27;ve been weighting all of my investments heavily in tech, because I&#x27;ve believed in the growth potential for a long time.<p>This sort of logic reminds me how people like to say things like &quot;Everyone thinks they&#x27;re an above average driver&quot;. Yes, it might be true that many 80% of people think they&#x27;re above the median skill, but that doesn&#x27;t mean there aren&#x27;t actual above average drivers out there.","48360682"
"48371610","tguedes","2026-06-02T15:33:29Z","You cherry-picked examples. Counter examples would be:<p>Crowdstrike up 1067%
Cloudflare up 1408%
Robinhood up 148%<p>For an index fund, I would take a break even or even a slight loss on AirBnb to get those Crowdstrike and Cloudflare returns. I do agree with the overall sentiment that the foundation AI companies are overvalued but the whole point of an index fund is not have to analyze each individual company.","48370659"
"48371392","martinald","2026-06-02T15:17:34Z","Don&#x27;t think so - the 3x is a separate cap. It actually reduces it down from market cap.<p>Eg say spaceX has $50bn of float at $1.5T valuation. If there wasn&#x27;t _any_ cap at all, the full $1.5T would be used as the market cap. With the (new) 3x cap, it means only $150bn of the $1.5T valuation is taken into account in the index weighting.<p>Before this change, SpaceX wouldn&#x27;t clear the 10% requirement to be listed in QQQ at all. So the 3x basically allows them to be included but _does not_ increase their market cap from $1.5T to $4.5T.<p>Btw, for clarity, I&#x27;m not saying there isn&#x27;t questionable behaviour going on here. My main point is that even if SpaceX, openai and anthropic all went to 0 (unlikely IMO), it&#x27;s not going to have a material impact on people&#x27;s retirements which is what OP was proposing.","48367243"
"48371189","throw0101c","2026-06-02T15:00:49Z","&gt; <i>If we are still likely to see rising interest rates, bonds feel like a bad idea.</i><p>Bonds are a bad idea until they&#x27;re not… at which point it may be too late to buy them.<p>And you (generally) don&#x27;t buy bonds for returns (at least not since the &#x27;80s). If you can sleep at night with the gyrations of The Market™ then go ahead and skip them, but also keep your timelines in mind (are you hoping to retire in 5-10 years, or make some other use of the money (downpayment)?).","48364927"
"48370932","groundzeros2015","2026-06-02T14:42:59Z","You’re right. I read this as banned the state from buying it (pensions etc). I agree that’s absurd if you were not allowed to buy through a broker.","48364854"
"48370659","randbyte","2026-06-02T14:21:47Z","What’s your argument besides name calling?<p>Please have it all, as long as don’t force my passive investments to be part of it.","48369882"
"48370415","xracy","2026-06-02T14:04:25Z","That&#x27;s justifying this because we&#x27;ve had rampant runaway inflation...<p>There&#x27;s nothing special about the number $1T.","48364223"
"48370379","root-parent","2026-06-02T14:01:51Z","We are not at CNBC, and that is the argument you hear there every 15 min from creatures like Cramer but this is about return on capital not revenue.","48360094"
"48370351","epsteingpt","2026-06-02T13:58:56Z","Why is anyone blaming the company management for &#x27;selling high&#x27;.<p>AI real expectations are about as frothy as they&#x27;ll ever be.<p>The latest models have legitimately taken senior coders from execution to agentic babysitting mode - something that was only a dream until last time.<p>There&#x27;s a rumor of a $500M MONTHLY Anthropic Bill - that is the equivalent total compensation of 10-15 THOUSAND senior ICs (L5, L6). Imagine what kind of company can spend that amount and pay their staff and somehow &#x27;see value&#x27;<p>The indexing argument is overblown. How many companies of the S&amp;P could the average commenter here name? My guess is - charitably - 30. Yes, weighting, etc. but every indexer here is buying in hundreds of companies they have <i>no idea</i> about the business of, and all of a sudden some percentage goes to a tech company they know about and they want to comment.<p>Let these people run their victory lap!","48358646"
"48369882","WarmWash","2026-06-02T13:16:22Z","Again, you can be a cynic and let others have your slice.","48364683"
"48369525","BryantD","2026-06-02T12:45:13Z","I was not a software engineer but yeah, I think so. Every now and then we’d have to go get Mike Burrows to do some consulting work to rewrite a bit more of the code in assembly.","48367651"
"48369515","lobocinza","2026-06-02T12:44:50Z","Anthropic is a software company.","48363785"
"48369496","BryantD","2026-06-02T12:42:36Z","It was a fun place to be. Sorry if I came across as curt — rereading that I was a bit more blunt than I intended. Sick cat has been stressing me.","48364933"
"48369477","ethbr1","2026-06-02T12:40:39Z","&quot;Google&quot; of today is really AdSense ($102M, 2003) -&gt; Android ($50M+?, 2005) -&gt; YouTube ($1.6B, 2006) -&gt; Google Docs ($50M+?, 2006)<p>Without those prescient and lucky acquisitions, we&#x27;d be talking about a &quot;Google&quot; that looked much more like Yahoo.<p>It wasn&#x27;t search proficiency that built the empire, it was leveraging a transient search quality advantage into cash flow, then plowing that cash into acquisitions to construct a durable moat.","48364993"
"48369370","jhy","2026-06-02T12:30:25Z","Thanks, AltaVista LiveTopics is a good keyword. I found:<p><a href=""https:&#x2F;&#x2F;www.researchgate.net&#x2F;figure&#x2F;Alta-Vista-LiveTopic-Graph_fig2_247392753"" rel=""nofollow"">https:&#x2F;&#x2F;www.researchgate.net&#x2F;figure&#x2F;Alta-Vista-LiveTopic-Gra...</a><p>which has some different coverage.<p>I did try to archive the blog you linked but unfortunately the owner is blocking it with robots.txt<p>User-agent: ia_archiver
Disallow: &#x2F;","48367808"
"48369368","BoggleOhYeah","2026-06-02T12:30:19Z","You are correct. That’s what I intended to say but I see that worded that comment unclearly.","48367783"
"48369102","lbreakjai","2026-06-02T12:01:56Z","(the) Public Benefit (the) corporation.","48360718"
"48369048","echoangle","2026-06-02T11:55:38Z","You&#x27;re paying a lot of premium if you buy a stock and then also short it to reduce your exposure.","48364378"
"48368939","moljac024","2026-06-02T11:42:23Z","I would argue models have been plateauing for quite some time now.","48368841"
"48368841","antasvara","2026-06-02T11:31:53Z","I&#x27;m not against a fundamentals-based argument. The revenue growth is wild and their margins are reported to be great. But the existential concern remains: what happens if models start plateauing?<p>I could be wrong, but the margins are so good because there isn&#x27;t a &quot;substitute&quot; for the frontier models. The performance difference between the latest Opus and a more open model provider is large enough to justify the extra cost. If that difference shrinks, I think the cost people are willing to pay will go way down.","48361720"
"48368750","bradleyjg","2026-06-02T11:22:38Z","The index don’t use the full market cap, they use free float. Except for nasdaq and the Dow which just pick numbers out of the air.<p>At least at first the spacex free float will be quite modest.","48363873"
"48368601","acdha","2026-06-02T11:03:14Z","That’s a specific bubble half a century into railroads transforming the American economy. While there were plenty of bad investments, that’s because so much of the economy depended on railroads to move goods and people.","48368002"
"48368442","kasey_junk","2026-06-02T10:42:46Z","Just to put some numbers on it, under current rules and valuations, if all 3 of SpaceX, OpenAI and Anthropic were to go public with their current valuations and be part of the nasdaq 100, and you were 100% allocated to that, you’d have ~8% portfolio exposure to them.  I suspect if you are the type of person who is 100% allocated to QQQ I’d guess you’d want _more_ exposure to those symbols than that.<p>For someone holding VTI its closer to 3% and a 2050 fund its more like 1.5%.  Indexing is how most people are investing in their retirement accounts because controversies like these just don’t matter much.  Hedging this off is going to cost more than its worth.","48362650"
"48368285","kasey_junk","2026-06-02T10:23:02Z","I learned computers and investing from my mother. She’s pretty competent approaching 80.","48363888"
"48368024","0xDEAFBEAD","2026-06-02T09:49:03Z","Historically speaking, this looks like a fantastic time to sell stocks.  Here&#x27;s the Shiller P&#x2F;E line graph:<p><a href=""https:&#x2F;&#x2F;www.multpl.com&#x2F;shiller-pe"" rel=""nofollow"">https:&#x2F;&#x2F;www.multpl.com&#x2F;shiller-pe</a><p>Valuations are literally at 1999 levels, and that&#x27;s <i>before</i> the coming IPOs.  No wonder they chose this moment to IPO.","48358965"
"48368014","0xDEAFBEAD","2026-06-02T09:47:35Z","Presumably, current Anthropic shareholders will buy buying other company stocks to diversify.","48360075"
"48368002","0xDEAFBEAD","2026-06-02T09:46:02Z","&gt;railroads had huge, immediate demand<p>Wikipedia states most capital in the late 1800s railroad bubble in the USA was &quot;involved in projects offering no immediate or early returns&quot; <a href=""https:&#x2F;&#x2F;en.wikipedia.org&#x2F;wiki&#x2F;Panic_of_1873"" rel=""nofollow"">https:&#x2F;&#x2F;en.wikipedia.org&#x2F;wiki&#x2F;Panic_of_1873</a>","48361747"
"48367911","0xDEAFBEAD","2026-06-02T09:34:50Z","Yeah I think it&#x27;s more realistic to reallocate to ETFs which skip the frothy stuff.  I wrote a comment about this in the other thread: <a href=""https:&#x2F;&#x2F;news.ycombinator.com&#x2F;item?id=48367563"">https:&#x2F;&#x2F;news.ycombinator.com&#x2F;item?id=48367563</a>","48360689"
"48367874","0xDEAFBEAD","2026-06-02T09:29:38Z","I doomer post because I see three basic possibilities:<p>* It&#x27;s a bubble, it crashes (no moat etc.)<p>* It&#x27;s not a bubble, we get superintelligence, it&#x27;s not nice, it squishes us all like bugs<p>* It&#x27;s not a bubble, we get superintelligence, it&#x27;s nice, we all get UBI<p>From the perspective of your personal financial security, the range of scenarios where you want to invest in Anthropic seems rather narrow.  And I don&#x27;t like to fund the creation of something which might squish me like a bug.","48363442"
"48367824","0xDEAFBEAD","2026-06-02T09:21:15Z","Exactly. Many people will choose the cheapest possible model that&#x27;s smart enough for their use case. &quot;Frontier&quot; is a transient property; open models tend to catch up in 6 months or so.","48365591"
"48367808","bsder","2026-06-02T09:18:22Z","I remember it being a Java applet with animations, but my memory could be terribly faulty at this point.<p>Following your comments and trying to trail things out, the <i>only</i> thing I can find is a reference to AltaVista LiveTopics.<p><a href=""https:&#x2F;&#x2F;dannysullivan.com&#x2F;why-search-sucks-you-wont-fix-it-the-way-you-think-203"" rel=""nofollow"">https:&#x2F;&#x2F;dannysullivan.com&#x2F;why-search-sucks-you-wont-fix-it-t...</a><p>I <i>suspect</i> what I used was that &quot;GRAPH&quot; button in the AltaVista Refine picture.<p>We might want to archive that image.  It seems like the only evidence that this stuff ever existed.","48367670"
"48367785","0xDEAFBEAD","2026-06-02T09:13:46Z","For reference, here&#x27;s an NYU prof&#x27;s website which shows typical ARR valuation multipliers by industry (see Price&#x2F;Sales ratio column):<p><a href=""https:&#x2F;&#x2F;pages.stern.nyu.edu&#x2F;~adamodar&#x2F;New_Home_Page&#x2F;datafile&#x2F;psdata.html"" rel=""nofollow"">https:&#x2F;&#x2F;pages.stern.nyu.edu&#x2F;~adamodar&#x2F;New_Home_Page&#x2F;datafile...</a><p>100x is staggering.  These companies are priced as though we are already chewing through the solar system to create AI computronium.  I&#x27;ll pass--I expect I&#x27;ll get a UBI when that scenario happens anyway.","48362166"
"48367783","mnicky","2026-06-02T09:13:17Z","I believe it&#x27;s the opposite :)
All major indices (S&amp;P500, MSCI, FTSE...) use free-float adjustments. And recently also NASDAQ - they&#x27;ve changed to cap of 3x the value of free-floating shares.","48363446"
"48367748","0xDEAFBEAD","2026-06-02T09:09:50Z","Revenue growth might be great, inference margins might be great.  Where&#x27;s the moat?","48361720"
"48367670","jhy","2026-06-02T08:55:59Z","That feature sounds amazing! I tried searching wayback etc but wasn&#x27;t able to find any more details. Do you happen to know of any screenshots &#x2F; deeper descriptions for it?<p>Perhaps we could nerd snipe Marginalia Search to add it :)","48364933"
"48367651","panick21_","2026-06-02T08:52:54Z","From the oral history interviews, it seem one of the tricks was keeping the core algorithm in cache completely.","48364324"
"48367585","elAhmo","2026-06-02T08:41:49Z","Knowing that investors in Elon&#x27;s companies blatantly trust his lies, a rocket exploding here and there is not going to make a dent in the stock price.","48361743"
"48367583","epolanski","2026-06-02T08:41:40Z","You can use Claude Code with DS4, I&#x27;m doing it as my daily driver.","48364508"
"48367560","elAhmo","2026-06-02T08:38:46Z","Profitability claims don&#x27;t really add up. They are not clear about what accounting methods they are using, and even if they might somehow show profitable quarter, they stated in their leak of numbers to WSJ that they might not end up the year being profitable.<p>This is just to pump their numbers for the IPO, profitability is nowhere close until we see the real numbers.","48361352"
"48367364","newsicanuse","2026-06-02T08:08:15Z","An economist exytrpolating tech trends is already a hard sell. And deterministic unreliability is atleast deterministic meaning you can choose to ignore, this is still better than probabilistic AI hubris","48366944"
"48367243","SkiFire13","2026-06-02T07:49:06Z","&gt; which means &#x27;retail&#x27; investors are going to have perhaps 5% of their portfolio in it<p>If I&#x27;m not reading it wrong though NASDAQ introduced a 3x multiplier for low-float stocks like SpaceX is most likely going to be (and maybe OpenAI and Anthropic too if they see that it works). A 15% exposure is then going to be pretty big.","48363873"
"48367178","ben_w","2026-06-02T07:38:57Z","This is not a useful response to &quot;how long does this last? I&#x27;ve been hearing it for a decade.&quot;<p>The phrase &quot;late capitalism&quot; itself has been used for just over a century now[0]; while I believe the USA is destroying what made the nation successful and will therefore probably[1] go into decline before 2035, there&#x27;s no particular reason to tie the weird aspects of the economic system to the USA&#x27;s political nonsense.<p>Also, the USSR would be the opposite example of your first sentence, as the collapse was a big surprise to everyone (both inside and outside the bloc) even a few years before it happened.<p>The Roman Empire would be the example for long-term decline, as that took one or more centuries depending on where you count the zenith (180 CE to 376 CE as the start, the Western Roman Empire was definitely dead by 476 CE).<p>But you seem to want to present it as a &quot;in our lifetime&quot; kind of thing; for that, I would suggest the British Empire, which peaked just before WW1, yet was obviously a broken power by the time of the Suez Crisis of 1956 just 42 years later though full decolonisation took longer (and if you ask Sinn Féin, Plaid Cymru, and the SNP, isn&#x27;t really finished).<p>[0] <a href=""https:&#x2F;&#x2F;en.wikipedia.org&#x2F;wiki&#x2F;Late_capitalism"" rel=""nofollow"">https:&#x2F;&#x2F;en.wikipedia.org&#x2F;wiki&#x2F;Late_capitalism</a><p>[1] There&#x27;s a very narrow path where enough anti-corruption votes combine for a government which does something that, ironically, Trump promised in his first term: &quot;drain the swamp&quot;. It can&#x27;t just be &quot;Dems win&quot;, it has to be broad consensus that not only takes this seriously but also is seen by the world to do so.","48363160"
"48367130","intended","2026-06-02T07:31:19Z","You&#x27;ve covered both bases here.<p>The issue is that the way the rules have been changed, risky stocks have been added to a product that is meant to be stable.<p>A 401k, any retirement focused product, is not serving its purpose when it tags on risk.<p>Having people in the later part of their lives find they are broke, becuse despite them doing everything right, a loophole was created to extract their savings.<p>This is simply not right.","48361720"
"48366944","ben_w","2026-06-02T07:00:41Z","<p><pre><code>  The growth of the Internet will slow drastically, as the flaw in “Metcalfe’s law”—which states that the number of potential connections in a network is proportional to the square of the number of participants—becomes apparent: most people have nothing to say to each other! By 2005 or so, it will become clear that the Internet’s impact on the economy has been no greater than the fax machine’s.
</code></pre>
- Nobel prize winning economist Paul Krugman, in 1998, <a href=""https:&#x2F;&#x2F;quoteinvestigator.com&#x2F;2023&#x2F;10&#x2F;26&#x2F;internet-fax&#x2F;"" rel=""nofollow"">https:&#x2F;&#x2F;quoteinvestigator.com&#x2F;2023&#x2F;10&#x2F;26&#x2F;internet-fax&#x2F;</a><p>(Why do people try to criticise AI as &quot;probabalistic&quot; like this matters? Unreliable I get, but early Wikipedia and Geocities were as deterministically unreliable as the amateur and fiction sections respectively of a bookstore)","48366070"
"48366183","reillyse","2026-06-02T04:46:59Z","I think the original comment was before the market sneezes. So we all know it will sneeze and the companies want to get in on this business cycle. The longer they leave it the more likely they will miss it.","48361770"
"48366070","newsicanuse","2026-06-02T04:30:03Z","I am really surprised that people are comparing dot com with AI. Atleast dot-com era was deterministic, comparatively AI is just a probabalistic unreliable slop","48361720"
"48366009","satvikpendem","2026-06-02T04:18:33Z","For now. Without industry of their own Europe won&#x27;t have a high quality of life much longer, as recent unemployment statistics already show.","48363688"
"48365859","BobbyTables2","2026-06-02T03:59:43Z","FWIW, I preferred AltaVista over Google back in the day.","48364324"
"48365815","returnInfinity","2026-06-02T03:54:57Z","The powers that be are already planning to ban Chinese models.","48358751"
"48365679","lmeyerov","2026-06-02T03:33:19Z","? Very much agreed, the IPO pop is a manufactured pricing event focused on investor dynamics rather than direct fair market pricing, making it more of a gamble than normal. Including gambles in index funds defeats the point.<p>Maybe the confusing point was my involvement is (discounted) pre-IPO shares, which almost by definition, is not an activity accessible to retail investors.","48363207"
